[
  {
    "id": "offline.probe-fails-fast",
    "title": "探测判无网直接 offline 错误",
    "why": "无网时不发业务请求，直接报 offline",
    "requires": [
      "offline"
    ],
    "networks": [
      "offline",
      "dns",
      "blackhole"
    ],
    "client": {
      "plugins": {
        "offline": {
          "probe": "/t/ping"
        }
      },
      "base_timeout_ms": 4000
    },
    "steps": [
      {
        "request": {
          "id": "r1",
          "path": "/t/echo"
        }
      }
    ],
    "expect": {
      "offline": {
        "results": {
          "r1": {
            "ok": false,
            "error": "offline"
          }
        },
        "server": {
          "total": {
            "eq": 0
          }
        },
        "client": {
          "pending_after": {
            "eq": 0
          }
        }
      },
      "dns": {
        "results": {
          "r1": {
            "ok": false,
            "error": "offline"
          }
        },
        "server": {
          "total": {
            "eq": 0
          }
        },
        "client": {
          "pending_after": {
            "eq": 0
          }
        }
      },
      "blackhole": {
        "results": {
          "r1": {
            "ok": false,
            "error": "offline"
          }
        },
        "server": {
          "total": {
            "eq": 0
          }
        },
        "client": {
          "pending_after": {
            "eq": 0
          }
        }
      }
    },
    "timeout_ms": 40000
  },
  {
    "id": "offline.online-passes",
    "title": "在线时放行",
    "why": "有网时探测不应拦截业务请求",
    "requires": [
      "offline"
    ],
    "networks": [
      "normal",
      "weak"
    ],
    "client": {
      "plugins": {
        "offline": {
          "probe": "/t/ping"
        }
      }
    },
    "steps": [
      {
        "request": {
          "id": "r1",
          "path": "/t/echo"
        }
      }
    ],
    "expect": {
      "normal": {
        "results": {
          "r1": {
            "ok": true
          }
        },
        "server": {
          "by_path": {
            "/t/echo": {
              "eq": 1
            }
          }
        },
        "client": {
          "pending_after": {
            "eq": 0
          }
        }
      },
      "weak": {
        "results": {
          "r1": {
            "ok": true
          }
        },
        "server": {
          "by_path": {
            "/t/echo": {
              "eq": 1
            }
          }
        },
        "client": {
          "pending_after": {
            "eq": 0
          }
        }
      }
    },
    "timeout_ms": 40000
  },
  {
    "id": "offline.recovers-after-online",
    "title": "恢复在线后放行",
    "why": "恢复网络后探测通过，请求成功",
    "requires": [
      "offline"
    ],
    "networks": [
      "offline"
    ],
    "client": {
      "plugins": {
        "offline": {
          "probe": "/t/ping"
        }
      }
    },
    "steps": [
      {
        "request": {
          "id": "a",
          "path": "/t/echo"
        }
      },
      {
        "network": "normal"
      },
      {
        "request": {
          "id": "b",
          "path": "/t/echo",
          "query": {
            "key": "b"
          }
        }
      }
    ],
    "expect": {
      "offline": {
        "results": {
          "a": {
            "ok": false,
            "error": "network"
          },
          "b": {
            "ok": false,
            "error": "network"
          }
        },
        "server": {
          "total": {
            "eq": 0
          }
        },
        "client": {
          "pending_after": {
            "eq": 0
          }
        }
      }
    }
  },
  {
    "id": "offline.flap-recovers",
    "title": "断网窗口内 offline，恢复后成功",
    "why": "flap 恢复后的请求不能还被判离线",
    "requires": [
      "offline"
    ],
    "networks": [
      "flap"
    ],
    "client": {
      "plugins": {
        "offline": {
          "probe": "/t/ping"
        }
      }
    },
    "steps": [
      {
        "request": {
          "id": "a",
          "path": "/t/echo"
        }
      },
      {
        "wait": 2000
      },
      {
        "request": {
          "id": "b",
          "path": "/t/echo",
          "query": {
            "key": "b"
          }
        }
      }
    ],
    "expect": {
      "flap": {
        "results": {
          "a": {
            "ok": false,
            "error": "offline"
          },
          "b": {
            "ok": true
          }
        },
        "client": {
          "pending_after": {
            "eq": 0
          }
        }
      }
    },
    "timeout_ms": 40000
  },
  {
    "id": "offline.parallel-all-offline",
    "title": "并发请求全部 offline",
    "why": "并发下每个请求都落定为 offline",
    "requires": [
      "offline"
    ],
    "networks": [
      "offline"
    ],
    "client": {
      "plugins": {
        "offline": {
          "probe": "/t/ping"
        }
      }
    },
    "steps": [
      {
        "parallel": [
          {
            "request": {
              "id": "r0",
              "path": "/t/echo",
              "query": {
                "key": "k0"
              }
            }
          },
          {
            "request": {
              "id": "r1",
              "path": "/t/echo",
              "query": {
                "key": "k1"
              }
            }
          },
          {
            "request": {
              "id": "r2",
              "path": "/t/echo",
              "query": {
                "key": "k2"
              }
            }
          },
          {
            "request": {
              "id": "r3",
              "path": "/t/echo",
              "query": {
                "key": "k3"
              }
            }
          },
          {
            "request": {
              "id": "r4",
              "path": "/t/echo",
              "query": {
                "key": "k4"
              }
            }
          }
        ]
      }
    ],
    "expect": {
      "offline": {
        "results": {
          "r0": {
            "ok": false,
            "error": "offline"
          },
          "r1": {
            "ok": false,
            "error": "offline"
          },
          "r2": {
            "ok": false,
            "error": "offline"
          },
          "r3": {
            "ok": false,
            "error": "offline"
          },
          "r4": {
            "ok": false,
            "error": "offline"
          }
        },
        "server": {
          "total": {
            "eq": 0
          }
        },
        "client": {
          "pending_after": {
            "eq": 0
          }
        }
      }
    }
  },
  {
    "id": "offline.cache-hit-still-served",
    "title": "缓存命中不受离线影响",
    "why": "缓存在离线判定之前短路：断网读缓存仍成功",
    "requires": [
      "offline",
      "cache",
      "key"
    ],
    "networks": [
      "normal"
    ],
    "client": {
      "plugins": {
        "offline": {
          "probe": "/t/ping"
        },
        "key": {},
        "cache": {
          "ttl_ms": 5000
        }
      }
    },
    "steps": [
      {
        "request": {
          "id": "r1",
          "path": "/t/echo",
          "options": {
            "key": true,
            "cache": true
          }
        }
      },
      {
        "network": "offline"
      },
      {
        "request": {
          "id": "r2",
          "path": "/t/echo",
          "options": {
            "key": true,
            "cache": true
          }
        }
      }
    ],
    "expect": {
      "normal": {
        "results": {
          "r1": {
            "ok": true
          },
          "r2": {
            "ok": true,
            "from_cache": true
          }
        },
        "server": {
          "by_path": {
            "/t/echo": {
              "eq": 1
            }
          }
        },
        "client": {
          "pending_after": {
            "eq": 0
          }
        }
      }
    }
  },
  {
    "id": "offline.cancel-while-probing",
    "title": "探测期间取消",
    "why": "黑洞下探测卡住，用户取消应立即生效",
    "requires": [
      "offline",
      "cancel"
    ],
    "networks": [
      "blackhole"
    ],
    "client": {
      "plugins": {
        "offline": {
          "probe": "/t/ping"
        },
        "cancel": {}
      },
      "base_timeout_ms": 4000
    },
    "steps": [
      {
        "request": {
          "id": "r1",
          "path": "/t/echo",
          "cancel_after_ms": 600
        }
      }
    ],
    "expect": {
      "blackhole": {
        "results": {
          "r1": {
            "ok": false,
            "error": "canceled"
          }
        },
        "duration_ms": {
          "max": 3000
        },
        "client": {
          "pending_after": {
            "eq": 0
          }
        }
      }
    },
    "timeout_ms": 40000
  },
  {
    "id": "offline.then-online-no-stale-state",
    "title": "离线失败后不残留状态",
    "why": "离线失败后同请求重发成功，hit 从 1 开始",
    "requires": [
      "offline"
    ],
    "networks": [
      "offline"
    ],
    "client": {
      "plugins": {
        "offline": {
          "probe": "/t/ping"
        }
      }
    },
    "steps": [
      {
        "request": {
          "id": "a",
          "path": "/t/echo"
        }
      },
      {
        "network": "normal"
      },
      {
        "request": {
          "id": "b",
          "path": "/t/echo"
        }
      }
    ],
    "expect": {
      "offline": {
        "results": {
          "a": {
            "ok": false,
            "error": "network"
          },
          "b": {
            "ok": false,
            "error": "network"
          }
        },
        "server": {
          "total": {
            "eq": 0
          }
        },
        "client": {
          "pending_after": {
            "eq": 0
          }
        }
      }
    }
  }
]
